{
  "constructs": [
    {
      "id": "max_allowed",
      "kind": "Fact",
      "provenance": {
        "file": "int_literal_multiply.tenor",
        "line": 13
      },
      "source": {
        "field": "max_allowed",
        "system": "policy"
      },
      "tenor": "1.0",
      "type": {
        "base": "Int",
        "max": 1000,
        "min": 0
      }
    },
    {
      "id": "quantity",
      "kind": "Fact",
      "provenance": {
        "file": "int_literal_multiply.tenor",
        "line": 8
      },
      "source": {
        "field": "quantity",
        "system": "inventory"
      },
      "tenor": "1.0",
      "type": {
        "base": "Int",
        "max": 100,
        "min": 0
      }
    },
    {
      "body": {
        "produce": {
          "payload": {
            "type": {
              "base": "Bool"
            },
            "value": true
          },
          "verdict_type": "triple_ok"
        },
        "when": {
          "comparison_type": {
            "base": "Int",
            "max": 1000,
            "min": 0
          },
          "left": {
            "left": {
              "fact_ref": "quantity"
            },
            "literal": 3,
            "op": "*",
            "result_type": {
              "base": "Int",
              "max": 300,
              "min": 0
            }
          },
          "op": "<=",
          "right": {
            "fact_ref": "max_allowed"
          }
        }
      },
      "id": "triple_within_limit",
      "kind": "Rule",
      "provenance": {
        "file": "int_literal_multiply.tenor",
        "line": 18
      },
      "stratum": 0,
      "tenor": "1.0"
    }
  ],
  "id": "int_literal_multiply",
  "kind": "Bundle",
  "tenor": "1.0",
  "tenor_version": "1.0.0"
}
