{"constructs":[{"default":"2024-01-15","id":"start_date","kind":"Fact","provenance":{"file":"fact_default_date.tenor","line":4},"source":{"field":"start_date","system":"contract_service"},"tenor":"1.0","type":{"base":"Date"}}],"id":"fact_default_date","kind":"Bundle","tenor":"1.0","tenor_version":"1.0.0"}
