{
  "constructs": [
    {
      "id": "shared_persona_system",
      "kind": "System",
      "members": [
        {
          "id": "contract_a",
          "path": "system_member_a.tenor"
        },
        {
          "id": "contract_b",
          "path": "system_member_b.tenor"
        }
      ],
      "provenance": {
        "file": "system_shared_persona.tenor",
        "line": 4
      },
      "shared_entities": [],
      "shared_personas": [
        {
          "contracts": [
            "contract_a",
            "contract_b"
          ],
          "persona": "applicant"
        }
      ],
      "tenor": "1.0",
      "triggers": []
    }
  ],
  "id": "system_shared_persona",
  "kind": "Bundle",
  "tenor": "1.0",
  "tenor_version": "1.0.0"
}
