{
  "constructs": [
    {
      "id": "inspector",
      "kind": "Persona",
      "provenance": {
        "file": "exists_quantifier.tenor",
        "line": 5
      },
      "tenor": "1.0"
    },
    {
      "id": "inspection_items",
      "kind": "Fact",
      "provenance": {
        "file": "exists_quantifier.tenor",
        "line": 12
      },
      "source": {
        "field": "items",
        "system": "inspection"
      },
      "tenor": "1.0",
      "type": {
        "base": "List",
        "element_type": {
          "base": "Record",
          "fields": {
            "compliant": {
              "base": "Bool"
            },
            "item_id": {
              "base": "Text",
              "max_length": 50
            }
          }
        },
        "max": 100
      }
    },
    {
      "body": {
        "produce": {
          "payload": {
            "type": {
              "base": "Bool"
            },
            "value": true
          },
          "verdict_type": "defect_found"
        },
        "when": {
          "body": {
            "left": {
              "field_ref": {
                "field": "compliant",
                "var": "item"
              }
            },
            "op": "=",
            "right": {
              "literal": false,
              "type": {
                "base": "Bool"
              }
            }
          },
          "domain": {
            "fact_ref": "inspection_items"
          },
          "quantifier": "exists",
          "variable": "item",
          "variable_type": {
            "base": "Record",
            "fields": {
              "compliant": {
                "base": "Bool"
              },
              "item_id": {
                "base": "Text",
                "max_length": 50
              }
            }
          }
        }
      },
      "id": "has_defect",
      "kind": "Rule",
      "provenance": {
        "file": "exists_quantifier.tenor",
        "line": 17
      },
      "stratum": 0,
      "tenor": "1.0"
    }
  ],
  "id": "exists_quantifier",
  "kind": "Bundle",
  "tenor": "1.0",
  "tenor_version": "1.0.0"
}
