{
  "constructs": [
    {
      "id": "claim_amount",
      "kind": "Fact",
      "provenance": {
        "file": "operation_outcomes.tenor",
        "line": 7
      },
      "source": {
        "field": "amount",
        "system": "claim"
      },
      "tenor": "1.0",
      "type": {
        "base": "Money",
        "currency": "USD"
      }
    },
    {
      "id": "Claim",
      "initial": "open",
      "kind": "Entity",
      "provenance": {
        "file": "operation_outcomes.tenor",
        "line": 12
      },
      "states": [
        "open",
        "approved",
        "denied"
      ],
      "tenor": "1.0",
      "transitions": [
        {
          "from": "open",
          "to": "approved"
        },
        {
          "from": "open",
          "to": "denied"
        }
      ]
    },
    {
      "id": "agent",
      "kind": "Persona",
      "provenance": {
        "file": "operation_outcomes.tenor",
        "line": 5
      },
      "tenor": "1.0"
    },
    {
      "allowed_personas": [
        "agent"
      ],
      "effects": [
        {
          "entity_id": "Claim",
          "from": "open",
          "outcome": "approved",
          "to": "approved"
        },
        {
          "entity_id": "Claim",
          "from": "open",
          "outcome": "denied",
          "to": "denied"
        }
      ],
      "error_contract": [
        "precondition_failed"
      ],
      "id": "decide_claim",
      "kind": "Operation",
      "outcomes": [
        "approved",
        "denied"
      ],
      "precondition": {
        "comparison_type": {
          "base": "Money",
          "currency": "USD"
        },
        "left": {
          "fact_ref": "claim_amount"
        },
        "op": ">",
        "right": {
          "literal": {
            "amount": {
              "kind": "decimal_value",
              "precision": 10,
              "scale": 2,
              "value": "0.00"
            },
            "currency": "USD"
          },
          "type": {
            "base": "Money",
            "currency": "USD"
          }
        }
      },
      "provenance": {
        "file": "operation_outcomes.tenor",
        "line": 18
      },
      "tenor": "1.0"
    }
  ],
  "id": "operation_outcomes",
  "kind": "Bundle",
  "tenor": "1.0",
  "tenor_version": "1.1.0"
}
