{"constructs":[{"id":"is_ready","kind":"Fact","provenance":{"file":"operation_implicit_outcome.tenor","line":11},"source":{"field":"ready","system":"task_service"},"tenor":"1.0","type":{"base":"Bool"}},{"id":"Task","initial":"open","kind":"Entity","provenance":{"file":"operation_implicit_outcome.tenor","line":5},"states":["open","closed"],"tenor":"1.0","transitions":[{"from":"open","to":"closed"}]},{"allowed_personas":["agent"],"effects":[{"entity_id":"Task","from":"open","to":"closed"}],"error_contract":["precondition_failed"],"id":"close_task","kind":"Operation","precondition":{"left":{"fact_ref":"is_ready"},"op":"=","right":{"literal":true,"type":{"base":"Bool"}}},"provenance":{"file":"operation_implicit_outcome.tenor","line":16},"tenor":"1.0"}],"id":"operation_implicit_outcome","kind":"Bundle","tenor":"1.0","tenor_version":"1.0.0"}
